{
  "$schema": "http://json-schema.org/draft-07/schema#",
  "title": "Step21Policy",
  "type": "object",
  "additionalProperties": false,
  "required": ["version", "description", "roles", "actions"],
  "properties": {
    "version": {"type": "string"},
    "description": {"type": "string"},
    "roles": {
      "type": "object",
      "patternProperties": {
        "^[A-Za-z0-9_]+$": {
          "type": "object",
          "additionalProperties": false,
          "required": ["allowed_actions"],
          "properties": {
            "allowed_actions": {
              "type": "array",
              "items": {"type": "string"}
            }
          }
        }
      },
      "additionalProperties": false
    },
    "actions": {
      "type": "object",
      "patternProperties": {
        "^[A-Za-z0-9_]+$": {
          "type": "object",
          "additionalProperties": false,
          "properties": {
            "payload_schema": {
              "type": "object",
              "additionalProperties": {
                "type": "object",
                "additionalProperties": false,
                "properties": {
                  "type": {"type": "string"},
                  "max_length": {"type": "integer"},
                  "no_control_chars": {"type": "boolean"},
                  "enum": {
                    "type": "array",
                    "items": {"type": "string"}
                  }
                }
              }
            },
            "trust": {
              "type": "object",
              "additionalProperties": false,
              "properties": {
                "min_score": {"type": "number"}
              }
            }
          }
        }
      },
      "additionalProperties": false
    }
  }
}
